<?xml version="1.0" encoding="UTF-8"?>
<xs:schema xmlns:xs="http://www.w3.org/2001/XMLSchema">
 <xs:element name="informeVentas">
    <xs:complexType>
      <xs:sequence>
        <xs:element name="cabecera">
          <xs:complexType>
            <xs:sequence>
              <xs:element name="titulo" type="xs:string"/>
              <xs:element name="descripcion" type="xs:string"/>
            </xs:sequence>
          </xs:complexType>
        </xs:element>
        <xs:element name="datos">
          <xs:complexType>
            <xs:sequence>
              <xs:element name="region" maxOccurs="unbounded">
                <xs:complexType>
                 <xs:sequence>
                    <xs:element name="trimestre" maxOccurs="unbounded">
                      <xs:complexType>
                        <xs:sequence>
                          <xs:element name="librosVendidos" type="xs:string"/>
                        </xs:sequence>
                        <xs:attribute name="numero" type="xs:int"/>
                      </xs:complexType>
                    </xs:element>
                 </xs:sequence>
                 <xs:attribute name="nombre" type="xs:string"/>
                </xs:complexType>
              </xs:element>
            </xs:sequence>
          </xs:complexType>
        </xs:element>
      </xs:sequence>
      <xs:attribute name="fecha" type="xs:string"/>
    </xs:complexType>
 </xs:element>
</xs:schema>
